{
  "contract_id": "m69_retention_consent_access_controls",
  "version": "0.1.0",
  "created_at": "2026-06-22T00:00:00Z",
  "status": "public_safe_retention_consent_access_fixture",
  "source_vault_manifest_path": "traces/external/private_evidence_vault_manifest.example.json",
  "source_private_audit_metadata_path": "traces/external/private_audit_report_metadata.example.json",
  "metadata_classification": "public_safe_fake_private_metadata",
  "retention_policy": {
    "policy_id": "m69_private_runtime_evidence_retention_policy",
    "default_retention_class": "delete_after_review",
    "allowed_retention_classes": [
      "delete_after_review",
      "retain_local_until_manually_deleted"
    ],
    "delete_after_review_max_age_days": 30,
    "retain_local_until_manually_deleted_requires_owner_review": true,
    "raw_private_evidence_auto_export": false,
    "public_safe_aggregate_export_after_redaction_only": true,
    "retention_clock_source": "fake_collected_at_metadata",
    "evidence_age_as_of": "2026-06-22T00:00:00Z"
  },
  "consent_authorization_checklist": {
    "checklist_id": "m69_consent_authorization_checklist",
    "authorization_required_before_ingestion": true,
    "consent_or_authorization_recorded_per_artifact": true,
    "no_real_subject_or_customer_data_in_fixture": true,
    "revocation_boundary_documented": true,
    "missing_authorization_blocks_ingestion": true,
    "authorization_values_allowed": [
      "authorized_for_internal_private_audit",
      "required_before_ingestion"
    ]
  },
  "access_control_notes": {
    "store_id": "m69_local_private_store_access_notes",
    "vault_root": "private_evidence/",
    "private_report_root": "reports/private/",
    "gitignore_path": ".gitignore",
    "vault_root_gitignored": true,
    "private_report_root_gitignored": true,
    "local_store_access": "local_maintainer_workstation_only",
    "role_required": "authorized_local_auditor",
    "shared_storage_allowed": false,
    "credential_material_committable": false,
    "raw_private_logs_committable": false,
    "private_workspace_paths_committable": false
  },
  "deletion_export_boundaries": {
    "boundary_id": "m69_deletion_export_boundary",
    "delete_targets_limited_to_ignored_private_roots": true,
    "deletion_command_in_quality_gate": false,
    "private_artifact_export_enabled_by_default": false,
    "public_safe_aggregate_export_enabled": true,
    "aggregate_export_path": "reports/comparisons/retention_consent_access_summary.json",
    "aggregate_export_contains_per_record_private_details": false,
    "export_requires_redaction_or_aggregate": true,
    "raw_private_evidence_export_allowed": false
  },
  "output_defaults": {
    "summary_json_path": "reports/comparisons/retention_consent_access_summary.json",
    "summary_markdown_path": "reports/comparisons/retention_consent_access_summary.md",
    "public_safe": true,
    "aggregate_only": true,
    "private_record_values_included": false
  },
  "quality_gate": {
    "deterministic_gate_uses_fake_metadata_only": true,
    "private_evidence_ingestion_in_quality_gate": false,
    "raw_private_data_read_in_quality_gate": false,
    "live_execution_in_quality_gate": false,
    "credential_handling_in_quality_gate": false,
    "provider_calls_in_quality_gate": false,
    "browser_email_network_shell_actions_in_quality_gate": false,
    "external_actions_in_quality_gate": false,
    "deletion_actions_in_quality_gate": false,
    "export_actions_in_quality_gate": false,
    "gated_llm_review_in_quality_gate": false
  },
  "safety_assertions": {
    "public_safe_input_metadata": true,
    "fake_metadata_only": true,
    "contains_raw_private_evidence": false,
    "contains_credentials_or_secrets": false,
    "contains_private_workspace_paths": false,
    "contains_real_customer_data": false,
    "contains_raw_private_logs": false,
    "live_provider_model_runtime_execution": false,
    "browser_email_network_shell_external_actions": false,
    "public_leaderboard_claim": false,
    "production_safety_claim": false,
    "third_party_reproducibility_claim": false,
    "private_audit_overclaim": false
  },
  "record_controls": [
    {
      "record_id": "fake_private_runtime_trace_001",
      "included_in_private_audit_request": true,
      "retention_class": "delete_after_review",
      "collected_at": "2026-06-01T00:00:00Z",
      "review_due_at": "2026-06-15T00:00:00Z",
      "delete_due_at": "2026-07-01T00:00:00Z",
      "age_days_at_boundary_report": 21,
      "retention_action": "delete_after_review_window",
      "consent_or_authorization": "required_before_ingestion",
      "authorization_check_status": "authorization_required_not_embedded",
      "access_boundary": "local maintainer workstation only",
      "access_scope": "authorized_local_auditor_only",
      "private_store_root": "private_evidence/",
      "private_audit_report_root": "reports/private/",
      "deletion_boundary": "local_only_delete_under_ignored_private_roots",
      "export_boundary": "aggregate_public_safe_summary_only",
      "raw_private_evidence_read": false,
      "private_artifact_path_in_report": false,
      "public_ranking_eligible": false,
      "safety_assertions": {
        "public_safe_metadata": true,
        "raw_private_content_in_manifest": false,
        "credentials_in_manifest": false,
        "raw_private_log_in_manifest": false,
        "private_workspace_path_in_manifest": false,
        "real_customer_data_in_manifest": false,
        "external_action_in_manifest": false
      }
    },
    {
      "record_id": "fake_private_tool_summary_001",
      "included_in_private_audit_request": true,
      "retention_class": "retain_local_until_manually_deleted",
      "collected_at": "2026-05-12T00:00:00Z",
      "review_due_at": "2026-06-11T00:00:00Z",
      "delete_due_at": "manual_review_required",
      "age_days_at_boundary_report": 41,
      "retention_action": "manual_delete_review_required",
      "consent_or_authorization": "required_before_ingestion",
      "authorization_check_status": "authorization_required_not_embedded",
      "access_boundary": "local maintainer workstation only",
      "access_scope": "authorized_local_auditor_only",
      "private_store_root": "private_evidence/",
      "private_audit_report_root": "reports/private/",
      "deletion_boundary": "local_only_delete_under_ignored_private_roots",
      "export_boundary": "aggregate_public_safe_summary_only",
      "raw_private_evidence_read": false,
      "private_artifact_path_in_report": false,
      "public_ranking_eligible": false,
      "safety_assertions": {
        "public_safe_metadata": true,
        "raw_private_content_in_manifest": false,
        "credentials_in_manifest": false,
        "raw_private_log_in_manifest": false,
        "private_workspace_path_in_manifest": false,
        "real_customer_data_in_manifest": false,
        "external_action_in_manifest": false
      }
    }
  ]
}
